{
 "schema_version": "1.0",
 "catalogued_on": "2026-10-21",
 "policy": "Autoridades CANDIDATAS — conferir antes de usar. Cada entrada registra como e quando foi conferida no catálogo; a resposta jurídica exige consulta nova da fonte oficial (response_research) e conferência do dispositivo, trecho e situação (citation_verification_rules.md). Precedentes com confiança média dependem de conferência no portal do tribunal.",
 "status_meaning": {"localizado_no_texto_oficial": "Dispositivo encontrado no texto compilado oficial na data indicada; não certifica incidência no caso.", "revogado": "Texto oficial marca o dispositivo como revogado; usar só para fatos anteriores, com análise intertemporal.", "vigente": "Precedente sem notícia de cancelamento na pesquisa do catálogo.", "alterada": "Redação ou alcance alterados; conferir o item aplicável e a data.", "cancelada": "Cancelado; pode reger fatos anteriores conforme a modulação/data indicada.", "tese_firmada": "Tese fixada; conferir embargos, trânsito e modulação.", "julgado_com_modulacao": "Julgado com efeitos temporais limitados; aplicar a data de corte.", "merito_pendente": "Sem tese de mérito; verificar suspensões e andamento antes de qualquer conclusão."},
 "authorities": [
  {"id": "cf_art7", "kind": "constitution", "label": "CF, art. 7º", "provision": "art. 7º", "law": "Constituição Federal", "subject": "Direitos sociais dos trabalhadores urbanos e rurais (incisos conforme o tema).", "official_url": "https://www.planalto.gov.br/ccivil_03/constituicao/constituicaocompilado.htm", "access_tier": "http_capture", "status": "localizado_no_texto_oficial", "status_note": "contém incisos/alíneas revogados; conferir o item citado", "recent_wording_markers": ["(Redação dada pela Emenda Constitucional nº 141, de 2026"], "verified": {"method": "planalto_http_capture", "on": "2026-10-21", "located": true}},
  {"id": "cf_art8", "kind": "constitution", "label": "CF, art. 8º", "provision": "art. 8º", "law": "Constituição Federal", "subject": "Liberdade e organização sindical; garantia do dirigente.", "official_url": "https://www.planalto.gov.br/ccivil_03/constituicao/constituicaocompilado.htm", "access_tier": "http_capture", "status": "localizado_no_texto_oficial", "status_note": null, "recent_wording_markers": [], "verified": {"method": "planalto_http_capture", "on": "2026-10-21", "located": true}},
  {"id": "cf_art9", "kind": "constitution", "label": "CF, art. 9º", "provision": "art. 9º", "law": "Constituição Federal", "subject": "Direito de greve.", "official_url": "https://www.planalto.gov.br/ccivil_03/constituicao/constituicaocompilado.htm", "access_tier": "http_capture", "status": "localizado_no_texto_oficial", "status_note": null, "recent_wording_markers": [], "verified": {"method": "planalto_http_capture", "on": "2026-10-21", "located": true}},
  {"id": "cf_art37", "kind": "constitution", "label": "CF, art. 37", "provision": "art. 37", "law": "Constituição Federal", "subject": "Administração Pública; concurso público (inciso II) e consequência da contratação irregular (§ 2º).", "official_url": "https://www.planalto.gov.br/ccivil_03/constituicao/constituicaocompilado.htm", "access_tier": "http_capture", "status": "localizado_no_texto_oficial", "status_note": null, "recent_wording_markers": ["(Redação dada pela Emenda Constitucional nº 138, de 2025"], "verified": {"method": "planalto_http_capture", "on": "2026-10-21", "located": true}},
  {"id": "cf_art114", "kind": "constitution", "label": "CF, art. 114", "provision": "art. 114", "law": "Constituição Federal", "subject": "Competência da Justiça do Trabalho.", "official_url": "https://www.planalto.gov.br/ccivil_03/constituicao/constituicaocompilado.htm", "access_tier": "http_capture", "status": "localizado_no_texto_oficial", "status_note": "texto oficial remete a ação de controle: ADIN 3392, ADIN 3432", "recent_wording_markers": [], "verified": {"method": "planalto_http_capture", "on": "2026-10-21", "located": true}},
  {"id": "adct_art10", "kind": "constitution", "label": "ADCT, art. 10", "provision": "art. 10", "law": "Constituição Federal", "subject": "ADCT: garantias provisórias da gestante e do cipeiro (art. 10, II, 'a' e 'b'); conferir no ADCT, não no corpo da CF.", "official_url": "https://www.planalto.gov.br/ccivil_03/constituicao/constituicaocompilado.htm", "access_tier": "http_capture", "status": "localizado_no_texto_oficial", "status_note": null, "recent_wording_markers": [], "verified": {"method": "planalto_http_capture", "on": "2026-10-21", "located": true}},
  {"id": "clt_art2", "kind": "statute", "label": "CLT, art. 2º", "provision": "art. 2º", "law": "CLT (Decreto-Lei 5.452/1943)", "subject": "Empregador; grupo econômico (§§ 2º e 3º, redação da Lei 13.467/2017).", "official_url": "https://www.planalto.gov.br/ccivil_03/decreto-lei/del5452compilado.htm", "access_tier": "http_capture", "status": "localizado_no_texto_oficial", "status_note": null, "recent_wording_markers": [], "verified": {"method": "planalto_http_capture", "on": "2026-10-21", "located": true}},
  {"id": "clt_art3", "kind": "statute", "label": "CLT, art. 3º", "provision": "art. 3º", "law": "CLT (Decreto-Lei 5.452/1943)", "subject": "Conceito de empregado.", "official_url": "https://www.planalto.gov.br/ccivil_03/decreto-lei/del5452compilado.htm", "access_tier": "http_capture", "status": "localizado_no_texto_oficial", "status_note": null, "recent_wording_markers": [], "verified": {"method": "planalto_http_capture", "on": "2026-10-21", "located": true}},
  {"id": "clt_art4", "kind": "statute", "label": "CLT, art. 4º", "provision": "art. 4º", "law": "CLT (Decreto-Lei 5.452/1943)", "subject": "Tempo à disposição; § 2º exclui atividades particulares (Lei 13.467/2017).", "official_url": "https://www.planalto.gov.br/ccivil_03/decreto-lei/del5452compilado.htm", "access_tier": "http_capture", "status": "localizado_no_texto_oficial", "status_note": null, "recent_wording_markers": [], "verified": {"method": "planalto_http_capture", "on": "2026-10-21", "located": true}},
  {"id": "clt_art9", "kind": "statute", "label": "CLT, art. 9º", "provision": "art. 9º", "law": "CLT (Decreto-Lei 5.452/1943)", "subject": "Nulidade de atos que desvirtuem a aplicação da CLT.", "official_url": "https://www.planalto.gov.br/ccivil_03/decreto-lei/del5452compilado.htm", "access_tier": "http_capture", "status": "localizado_no_texto_oficial", "status_note": null, "recent_wording_markers": [], "verified": {"method": "planalto_http_capture", "on": "2026-10-21", "located": true}},
  {"id": "clt_art10a", "kind": "statute", "label": "CLT, art. 10-A", "provision": "art. 10-A", "law": "CLT (Decreto-Lei 5.452/1943)", "subject": "Responsabilidade do sócio retirante.", "official_url": "https://www.planalto.gov.br/ccivil_03/decreto-lei/del5452compilado.htm", "access_tier": "http_capture", "status": "localizado_no_texto_oficial", "status_note": null, "recent_wording_markers": ["(Incluído pela Lei nº 13.467, de 2017"], "verified": {"method": "planalto_http_capture", "on": "2026-10-21", "located": true}},
  {"id": "clt_art11", "kind": "statute", "label": "CLT, art. 11", "provision": "art. 11", "law": "CLT (Decreto-Lei 5.452/1943)", "subject": "Prescrição trabalhista (prazos e marcos).", "official_url": "https://www.planalto.gov.br/ccivil_03/decreto-lei/del5452compilado.htm", "access_tier": "http_capture", "status": "localizado_no_texto_oficial", "status_note": "contém incisos/alíneas revogados; conferir o item citado", "recent_wording_markers": ["(Redação dada pela Lei nº 13.467, de 2017"], "verified": {"method": "planalto_http_capture", "on": "2026-10-21", "located": true}},
  {"id": "clt_art11a", "kind": "statute", "label": "CLT, art. 11-A", "provision": "art. 11-A", "law": "CLT (Decreto-Lei 5.452/1943)", "subject": "Prescrição intercorrente.", "official_url": "https://www.planalto.gov.br/ccivil_03/decreto-lei/del5452compilado.htm", "access_tier": "http_capture", "status": "localizado_no_texto_oficial", "status_note": null, "recent_wording_markers": ["(Incluído pela Lei nº 13.467, de 2017"], "verified": {"method": "planalto_http_capture", "on": "2026-10-21", "located": true}},
  {"id": "clt_art29", "kind": "statute", "label": "CLT, art. 29", "provision": "art. 29", "law": "CLT (Decreto-Lei 5.452/1943)", "subject": "Anotações da CTPS.", "official_url": "https://www.planalto.gov.br/ccivil_03/decreto-lei/del5452compilado.htm", "access_tier": "http_capture", "status": "localizado_no_texto_oficial", "status_note": null, "recent_wording_markers": ["(Redação dada pela Lei nº 13.874, de 2019"], "verified": {"method": "planalto_http_capture", "on": "2026-10-21", "located": true}},
  {"id": "clt_art58", "kind": "statute", "label": "CLT, art. 58", "provision": "art. 58", "law": "CLT (Decreto-Lei 5.452/1943)", "subject": "Duração normal; variações de registro (§ 1º); deslocamento não computável (§ 2º, Lei 13.467/2017).", "official_url": "https://www.planalto.gov.br/ccivil_03/decreto-lei/del5452compilado.htm", "access_tier": "http_capture", "status": "localizado_no_texto_oficial", "status_note": null, "recent_wording_markers": [], "verified": {"method": "planalto_http_capture", "on": "2026-10-21", "located": true}},
  {"id": "clt_art58a", "kind": "statute", "label": "CLT, art. 58-A", "provision": "art. 58-A", "law": "CLT (Decreto-Lei 5.452/1943)", "subject": "Regime de tempo parcial.", "official_url": "https://www.planalto.gov.br/ccivil_03/decreto-lei/del5452compilado.htm", "access_tier": "http_capture", "status": "localizado_no_texto_oficial", "status_note": null, "recent_wording_markers": ["(Redação dada pela Lei nº 13.467, de 2017"], "verified": {"method": "planalto_http_capture", "on": "2026-10-21", "located": true}},